{
  "version": 1,
  "baseUrl": "https://magazine.ecash.mx",
  "sourceRevision": "7b5cc72c05ee9deb74f26ff85edd209ee2d9b511",
  "articles": [
    {
      "id": "bitcoin-abc-corrige-error-raro-en-chronik-en-ultima-version",
      "url": "/analisis/bitcoin-abc-corrige-error-raro-en-chronik-en-ultima-version.html",
      "sourcePath": "analisis/bitcoin-abc-corrige-error-raro-en-chronik-en-ultima-version.html",
      "title": "Bitcoin ABC 0.33.6 corrige un fallo raro de Chronik: por qué importa para la infraestructura eCash",
      "genre": "Análisis técnico",
      "originalGenreLabel": "Análisis técnico",
      "classificationStatus": "confirmed",
      "section": null,
      "topics": [],
      "author": null,
      "publishedAt": null,
      "updatedAt": null,
      "summary": "La versión 0.33.6 de Bitcoin ABC incluye una corrección discreta pero importante para Chronik: evita un posible colapso del indexador bajo circunstancias poco comunes. Para operadores de nodos, exploradores y aplicaciones construidas sobre eCash, este tipo de actualización no es cosmética: es mantenimiento crítico de infraestructura.",
      "image": null,
      "tags": [],
      "readingMinutes": null,
      "references": [],
      "related": [],
      "language": "es-MX",
      "evidenceLimitations": [],
      "metadataProvenance": {
        "title": "analisis/bitcoin-abc-corrige-error-raro-en-chronik-en-ultima-version.html :: /html/body/div[2]/main/section/div/h1",
        "url": "Ruta pública existente: analisis/bitcoin-abc-corrige-error-raro-en-chronik-en-ultima-version.html",
        "genre": "analisis/bitcoin-abc-corrige-error-raro-en-chronik-en-ultima-version.html :: rótulo editorial observado: Análisis técnico (normalización literal; no se usa la carpeta)",
        "summary": "analisis/bitcoin-abc-corrige-error-raro-en-chronik-en-ultima-version.html :: /html/body/div[2]/main/section/div/p",
        "language": "analisis/bitcoin-abc-corrige-error-raro-en-chronik-en-ultima-version.html :: html[lang]"
      },
      "pendingMetadata": [
        "section",
        "author",
        "publishedAt",
        "updatedAt",
        "image",
        "readingMinutes",
        "topics"
      ]
    },
    {
      "id": "ecash-mining-variance",
      "url": "/analisis/ecash-mining-variance.html",
      "sourcePath": "analisis/ecash-mining-variance.html",
      "title": "Ocho horas sin encontrar un bloque: ¿señal alcista o simple varianza minera en eCash?",
      "genre": "Análisis técnico",
      "originalGenreLabel": "Análisis técnico",
      "classificationStatus": "confirmed",
      "section": null,
      "topics": [],
      "author": {
        "name": "eCash Magazine México",
        "type": "Organization"
      },
      "publishedAt": null,
      "updatedAt": null,
      "summary": "Un aumento del hashrate puede reflejar mayor rentabilidad y actividad minera, pero no demuestra por sí mismo que los mineros anticipen un movimiento extraordinario del mercado.",
      "image": null,
      "tags": [],
      "readingMinutes": null,
      "references": [
        {
          "url": "https://e.cash/mining",
          "label": "Fuente: eCash Mining",
          "kind": "reference",
          "category": null,
          "classificationStatus": "pending",
          "provenance": "analisis/ecash-mining-variance.html :: /html/body/div/article/main/p[10]/a"
        },
        {
          "url": "https://e.cash/blog/block-explorer",
          "label": "Fuente",
          "kind": "reference",
          "category": null,
          "classificationStatus": "pending",
          "provenance": "analisis/ecash-mining-variance.html :: /html/body/div/article/main/p[18]/a"
        }
      ],
      "related": [],
      "language": "es-MX",
      "evidenceLimitations": [
        {
          "text": "El dato fue compartido de manera comunitaria y no ha sido verificado de forma independiente mediante estadísticas públicas completas de la operación. Sin embargo, resulta útil como punto de partida para analizar una pregunta recurrente dentro de las redes Proof-of-Work:",
          "provenance": "analisis/ecash-mining-variance.html :: /html/body/div/article/main/p[2]"
        }
      ],
      "metadataProvenance": {
        "title": "analisis/ecash-mining-variance.html :: /html/body/div/article/header/h1",
        "url": "Ruta pública existente: analisis/ecash-mining-variance.html",
        "genre": "analisis/ecash-mining-variance.html :: rótulo editorial observado: Análisis técnico (normalización literal; no se usa la carpeta)",
        "author": "analisis/ecash-mining-variance.html :: firma visible",
        "summary": "analisis/ecash-mining-variance.html :: /html/body/div/article/header/p",
        "references": "Proveniencia individual en references[].provenance. Tipos commit/PR/transacción/bloque responden a identificadores explícitos, no a verificación nueva de su contenido.",
        "language": "analisis/ecash-mining-variance.html :: html[lang]",
        "evidenceLimitations": "Pasajes literales que delimitan comprobación; proveniencia por elemento."
      },
      "pendingMetadata": [
        "section",
        "publishedAt",
        "updatedAt",
        "image",
        "readingMinutes",
        "topics",
        "referenceClassification"
      ]
    },
    {
      "id": "gobernanza-rmz-ecash-mexico",
      "url": "/analisis/gobernanza-rmz-ecash-mexico.html",
      "sourcePath": "analisis/gobernanza-rmz-ecash-mexico.html",
      "title": "Gobernanza con RMZ: identidad, reputación y voto verificable para el ecosistema eCash",
      "genre": "Análisis técnico",
      "originalGenreLabel": "Análisis técnico",
      "classificationStatus": "confirmed",
      "section": null,
      "topics": [],
      "author": null,
      "publishedAt": null,
      "updatedAt": null,
      "summary": "xolosArmy desarrolla un modelo experimental de gobernanza para eCash que conecta alias .xec, posesión de RMZ, votaciones firmadas y reputación basada en evidencia pública. La propuesta evita que el poder electoral aumente automáticamente con el balance de tokens, pero continúa en fase MVP y deberá resolver desafíos relacionados con identidades múltiples, persistencia de datos, operación independiente y legitimidad comunitaria.",
      "image": null,
      "tags": [],
      "readingMinutes": null,
      "references": [],
      "related": [],
      "language": "es-MX",
      "evidenceLimitations": [],
      "metadataProvenance": {
        "title": "analisis/gobernanza-rmz-ecash-mexico.html :: /html/body/div/header/h1",
        "url": "Ruta pública existente: analisis/gobernanza-rmz-ecash-mexico.html",
        "genre": "analisis/gobernanza-rmz-ecash-mexico.html :: rótulo editorial observado: Análisis técnico (normalización literal; no se usa la carpeta)",
        "summary": "analisis/gobernanza-rmz-ecash-mexico.html :: /html/body/div/header/p",
        "language": "analisis/gobernanza-rmz-ecash-mexico.html :: html[lang]"
      },
      "pendingMetadata": [
        "section",
        "author",
        "publishedAt",
        "updatedAt",
        "image",
        "readingMinutes",
        "topics"
      ]
    },
    {
      "id": "multifirma-tonalli-wallet-bovedas-p2sh-ecash",
      "url": "/analisis/multifirma-tonalli-wallet-bovedas-p2sh-ecash.html",
      "sourcePath": "analisis/multifirma-tonalli-wallet-bovedas-p2sh-ecash.html",
      "title": "[Análisis técnico] Tonalli Wallet y P2SH: cómo funciona una bóveda 2-de-3 en eCash",
      "genre": "Análisis técnico",
      "originalGenreLabel": "Análisis técnico",
      "classificationStatus": "confirmed",
      "section": null,
      "topics": [
        {
          "label": "multifirma en Tonalli Wallet",
          "slug": "multifirma-en-tonalli-wallet",
          "provenance": "analisis/multifirma-tonalli-wallet-bovedas-p2sh-ecash.html :: JSON-LD keywords"
        },
        {
          "label": "wallet multifirma eCash",
          "slug": "wallet-multifirma-ecash",
          "provenance": "analisis/multifirma-tonalli-wallet-bovedas-p2sh-ecash.html :: JSON-LD keywords"
        },
        {
          "label": "bóveda 2-de-3",
          "slug": "boveda-2-de-3",
          "provenance": "analisis/multifirma-tonalli-wallet-bovedas-p2sh-ecash.html :: JSON-LD keywords"
        },
        {
          "label": "P2SH en eCash",
          "slug": "p2sh-en-ecash",
          "provenance": "analisis/multifirma-tonalli-wallet-bovedas-p2sh-ecash.html :: JSON-LD keywords"
        },
        {
          "label": "tesorería XEC",
          "slug": "tesoreria-xec",
          "provenance": "analisis/multifirma-tonalli-wallet-bovedas-p2sh-ecash.html :: JSON-LD keywords"
        },
        {
          "label": "administración compartida de XEC",
          "slug": "administracion-compartida-de-xec",
          "provenance": "analisis/multifirma-tonalli-wallet-bovedas-p2sh-ecash.html :: JSON-LD keywords"
        }
      ],
      "author": null,
      "publishedAt": null,
      "updatedAt": null,
      "summary": "El código público de Tonalli Wallet contiene un flujo experimental para bóvedas P2SH m-de-n con XEC puro. En una configuración 2-de-3, cada input requiere al menos dos firmas válidas para poder transmitirse. La arquitectura reduce la dependencia de una sola llave, pero todavía exige coordinación manual, carece de pruebas funcionales automatizadas dedicadas al flujo y no presenta una auditoría de seguridad independiente publicada.",
      "image": {
        "src": "https://i.imgur.com/eRiUhXC.jpeg",
        "alt": "Xoloitzcuintle custodia una bóveda digital P2SH con un esquema multifirma 2-de-3 de Tonalli Wallet sobre eCash.",
        "width": 1672,
        "height": 941
      },
      "tags": [
        "multifirma en Tonalli Wallet",
        "wallet multifirma eCash",
        "bóveda 2-de-3",
        "P2SH en eCash",
        "tesorería XEC",
        "administración compartida de XEC"
      ],
      "readingMinutes": null,
      "references": [
        {